{
  "$schema": "./schemas/codeksei-config-v2.json",
  "modeClass": "hosted-proactive",
  "workspaceRoot": "/absolute/path/to/workspace",
  "stateDir": "/absolute/path/to/state",
  "user": {
    "id": "user_123",
    "name": "Your Name",
    "timezone": "Asia/Shanghai"
  },
  "host": {
    "provider": "hermes",
    "runtimeProvider": "hermes",
    "runtimeOwner": "host",
    "channelProvider": "hermes",
    "channelKind": "weixin",
    "deliveryRecipe": "hermes-origin",
    "channel": "weixin"
  }
}
